Ultimate lemon meringue pie,You can't go wrong with one of Angela Nilsen's ultimates and this is no exception...,3 hours and 15 mins,Easy,true
Beef ragout,Add a modern-day twist to a classic bolognese with Tom Kerridge's exquisite beef ragout. Serve with hand-cut pappardelle pasta for a great dinner party dish...,3 hours and 55 mins,More effort,false
One-pot chicken chasseur,This French bistro classic is easy to make at home and fabulous with creamy mash or crusty bread,1 hour and 50 mins,Easy,true
Banh mi,bread,2 hours 30 minutes,More effort,true
Michelada (Mexican beer cocktail),On a warm summer evening start the weekend with an easy Mexican-inspired cocktail,5 mins,Easy,true
Fish pie - in four steps,Delicious and easy - a fish pie anyone can make. You'll learn how to poach fish and make a white sauce too...,1 hour and 15 mins,Easy,false
